{
  "$schema": "../../schemas/project.schema.json",
  "schema_version": "1.0",
  "kind": "project_manifest",
  "readiness": "draft",
  "project_id": "open-platform-candidate",
  "task_family": "simple-open-platform",
  "data_role": "demo_regression",
  "source_repository": "loonwerks/INSPECTA-models",
  "source_revision": null,
  "source_inventory": null,
  "source_root": null,
  "model_roots": [],
  "requirement_ledger": null,
  "architecture_reference": null,
  "comparison_policy": "equivalence",
  "approved_change_manifest": null,
  "toolchain_profile": "resolve-supported-profile",
  "toolchain_lock": null,
  "required_gates": [
    "parse_type",
    "requirements_coverage",
    "architecture",
    "independent_requirements_tests",
    "configured_formal_verification",
    "configured_build",
    "review"
  ],
  "agent_editable_paths": [],
  "protected_paths": [],
  "independent_evidence": [],
  "exposure_reviewed": false,
  "source_approved": false,
  "notes": "Draft locator, not a bundled project/solution or held-out claim. Inspect actual source paths and target-specific gates, approve ledger and architecture, and replace all unresolved fields before running."
}
